{
  "schema_version": "1.0.0",
  "panel_id": "F4_B",
  "status": "partial_reproduction",
  "generated_at_utc": "2026-08-15T09:26:30.281743Z",
  "command": [
    ".venv/bin/python3.12",
    "analyses/figure_04_revision/panel_b/scripts/reproduce.py"
  ],
  "inputs": [
    {
      "relative_path": "analyses/figure_04_revision/build.py",
      "sha256": "e75f82bb58e69cc6d776f04661b1d627d148254eaf628fa1e5a2d11d72f3b162",
      "bytes": 44440
    },
    {
      "relative_path": "analyses/figure_04_revision/panel_b/scripts/reproduce.py",
      "sha256": "bbcd7832683012a501bebf40354b8aa1bca1649981a88cc4bdcda8f541151675",
      "bytes": 289
    },
    {
      "relative_path": "analyses/figure_04_revision/panel_b/config/panel.json",
      "sha256": "7851e837ae9be81202664e741fbba1b3fe1f5431118d6c087fcfceed77427f7e",
      "bytes": 143
    },
    {
      "relative_path": "data/external/promoter_series_proteomics/sector_mass_fractions.tsv",
      "sha256": "333a94fffe36510855dc75b6f6710585ec267f5bef51e9d6f215d76627e9d7a7",
      "bytes": 22004
    },
    {
      "relative_path": "data/external/promoter_series_proteomics/protein_massfrac_annotated.csv",
      "sha256": "89bc1046b89852c2ac3fa70d6c675edb2b4d255d87651dbab6b760d1d2878008",
      "bytes": 27892466,
      "rows": 66024
    },
    {
      "relative_path": "analyses/figure_04_revision/config/protein_sector_overrides.csv",
      "sha256": "3b966b06bca45ec8ffd19c129a01392e6044bf3a72e9b173520f2a835480fa79",
      "bytes": 1144,
      "rows": 2
    },
    {
      "relative_path": "data/external/cell_economy_results/c_limitation/steady_state_flag_0.00.csv",
      "sha256": "3d2752758300b7bf21d872f565f6e386e56bb77b481086121a4edefc618e88a0",
      "bytes": 6663,
      "rows": 12
    },
    {
      "relative_path": "data/external/cell_economy_results/c_limitation/steady_state_flag_0.01.csv",
      "sha256": "8d8e11c3e18d3476bde0cae5f5bcbf9174fcf0d86ec42996cc16843c2993ff93",
      "bytes": 6799,
      "rows": 12
    },
    {
      "relative_path": "data/external/cell_economy_results/c_limitation/steady_state_flag_0.02.csv",
      "sha256": "8b0f893a45f7096fa0c5f13ef2dc6f243466d7e5681c082d01e93c2278b72a21",
      "bytes": 6833,
      "rows": 12
    },
    {
      "relative_path": "data/external/cell_economy_results/c_limitation/steady_state_flag_0.03.csv",
      "sha256": "69dd0697404a7c166c0f57f23693cb1cf4cd7134407673468a35e53f20821082",
      "bytes": 6806,
      "rows": 12
    },
    {
      "relative_path": "data/external/cell_economy_results/c_limitation/steady_state_flag_0.04.csv",
      "sha256": "71fb513b80e8ad4bc1cf694ce495ab32fec52ff746ed6994ffe5c589fa5b6687",
      "bytes": 6819,
      "rows": 12
    },
    {
      "relative_path": "data/external/cell_economy_results/c_limitation/steady_state_flag_0.05.csv",
      "sha256": "fbca4fc047581191f94d1bfb1313030e2c15d308ad7f7c4cfeb6a2795b6b03c3",
      "bytes": 6829,
      "rows": 12
    }
  ],
  "outputs": [
    {
      "relative_path": "build/panels/Figure_4/B/Figure_4_B.pdf",
      "sha256": "1e20bac01ddad1f8d163cb7e266659462617e3280df27a2573b00240ef1d58d3",
      "bytes": 41362
    },
    {
      "relative_path": "build/panels/Figure_4/B/Figure_4_B.png",
      "sha256": "cf496668911e8ebbba7574e86e18f54f63e7660ab905b459f13d8f3d75232544",
      "bytes": 116896
    },
    {
      "relative_path": "build/panels/Figure_4/B/Figure_4_B.svg",
      "sha256": "8c2cdd90d29630402d5baa213d36a121c1f6757c7a510ac6e58fd2adf35d71e3",
      "bytes": 93753
    },
    {
      "relative_path": "build/source_data/Figure_4/B/delta_overlay.csv",
      "sha256": "99b014b516cfea098f0c106e3635cc4631707ec9cfcbd2991f10c574f90c7d19",
      "bytes": 15821,
      "rows": 240
    },
    {
      "relative_path": "build/statistics/Figure_4/B/A1_sector_regressions.csv",
      "sha256": "072c451d0b076a0e7b7a2893f788596bde841972b4b7cb0693e917f86a8a795e",
      "bytes": 1640,
      "rows": 7
    }
  ],
  "software": {
    "python": "3.12.11",
    "pandas": "2.3.3",
    "numpy": "2.5.2",
    "matplotlib": "3.11.1"
  },
  "parameters": {
    "overlay_reference": "delta from experimental \u0394flhDC and model 0%",
    "protein_label_relative_threshold": 0.15,
    "protein_label_absolute_floor": 0.0006,
    "protein_label_abundance_leader_rank": 3,
    "sector_overrides": {
      "P0A2E3": "Fla to Oth",
      "P0A2C5": "Fla to Tra"
    },
    "a1_inferential_unit": "six condition means"
  },
  "random_seeds": {},
  "limitations": [
    "Proteomics begins from the collaborator protein-level export rather than raw MS files.",
    "Sector assignment follows the delivered KEGG mapping except for the proteins listed in analyses/figure_04_revision/config/protein_sector_overrides.csv, which records one reason per protein."
  ]
}
