{
  "schema_version": "1.0.0",
  "panel_id": "F4_C",
  "status": "partial_reproduction",
  "generated_at_utc": "2026-08-15T09:26:30.331436Z",
  "command": [
    ".venv/bin/python3.12",
    "analyses/figure_04_revision/panel_c/scripts/reproduce.py"
  ],
  "inputs": [
    {
      "relative_path": "analyses/figure_04_revision/build.py",
      "sha256": "e75f82bb58e69cc6d776f04661b1d627d148254eaf628fa1e5a2d11d72f3b162",
      "bytes": 44440
    },
    {
      "relative_path": "analyses/figure_04_revision/panel_c/scripts/reproduce.py",
      "sha256": "65381dfe87dd2d6603ea1b28a2896e92d494e606e664d1f95f4f4cdcde6141ab",
      "bytes": 289
    },
    {
      "relative_path": "analyses/figure_04_revision/panel_c/config/panel.json",
      "sha256": "6d0de49d5f3553c2cf3ede13093423b9419c06c6c555effd6fde328881f0b571",
      "bytes": 143
    },
    {
      "relative_path": "data/external/promoter_series_proteomics/sector_mass_fractions.tsv",
      "sha256": "333a94fffe36510855dc75b6f6710585ec267f5bef51e9d6f215d76627e9d7a7",
      "bytes": 22004
    },
    {
      "relative_path": "data/external/promoter_series_proteomics/protein_massfrac_annotated.csv",
      "sha256": "89bc1046b89852c2ac3fa70d6c675edb2b4d255d87651dbab6b760d1d2878008",
      "bytes": 27892466,
      "rows": 66024
    },
    {
      "relative_path": "analyses/figure_04_revision/config/protein_sector_overrides.csv",
      "sha256": "3b966b06bca45ec8ffd19c129a01392e6044bf3a72e9b173520f2a835480fa79",
      "bytes": 1144,
      "rows": 2
    }
  ],
  "outputs": [
    {
      "relative_path": "build/panels/Figure_4/C/Figure_4_C.pdf",
      "sha256": "52e467c29cf4cb0e74c21e69b111656222b5c2148d204a08f314dac4b93545a1",
      "bytes": 36143
    },
    {
      "relative_path": "build/panels/Figure_4/C/Figure_4_C.png",
      "sha256": "a8ff06b7cb62e197ce4095da7b0f64e27a31af237e4a69f8dc92188fedd90037",
      "bytes": 86898
    },
    {
      "relative_path": "build/panels/Figure_4/C/Figure_4_C.svg",
      "sha256": "af355f859f4e8ba57f08d2db29730c0c0602c237df52f7ebae980b97746a2fec",
      "bytes": 174212
    },
    {
      "relative_path": "build/source_data/Figure_4/C/label_audit.csv",
      "sha256": "762422933845190d565b6fa478ca01be02040a7d7f565f23234b1a58e61c9606",
      "bytes": 12648,
      "rows": 80
    },
    {
      "relative_path": "build/source_data/Figure_4/C/top10_proteins.csv",
      "sha256": "90a67cc6792393a7569d0325e108995799d9b31e7e42f9560f99b9ce73cb24b0",
      "bytes": 32275,
      "rows": 480
    }
  ],
  "software": {
    "python": "3.12.11",
    "pandas": "2.3.3",
    "numpy": "2.5.2",
    "matplotlib": "3.11.1"
  },
  "parameters": {
    "overlay_reference": "delta from experimental \u0394flhDC and model 0%",
    "protein_label_relative_threshold": 0.15,
    "protein_label_absolute_floor": 0.0006,
    "protein_label_abundance_leader_rank": 3,
    "sector_overrides": {
      "P0A2E3": "Fla to Oth",
      "P0A2C5": "Fla to Tra"
    },
    "a1_inferential_unit": "six condition means"
  },
  "random_seeds": {},
  "limitations": [
    "Proteomics begins from the collaborator protein-level export rather than raw MS files.",
    "Sector assignment follows the delivered KEGG mapping except for the proteins listed in analyses/figure_04_revision/config/protein_sector_overrides.csv, which records one reason per protein."
  ]
}
