{
  "schema_version": "1.0.0",
  "panel_id": "F5_C",
  "status": "partial_reproduction",
  "generated_at_utc": "2026-08-15T09:03:18.375543Z",
  "command": [
    ".venv/bin/python3.12",
    "analyses/figure_05_revision/panel_c/scripts/reproduce.py"
  ],
  "inputs": [
    {
      "relative_path": "analyses/figure_05_revision/build.py",
      "sha256": "59d1f903db24c761e13e20a4d543cb2fbc8331562c7e600de30cb8555550e382",
      "bytes": 46905
    },
    {
      "relative_path": "analyses/figure_05_revision/panel_c/scripts/reproduce.py",
      "sha256": "f15ae67dce82a8cf89a9efab84fadfb128759513806ca59284231671c23b72a4",
      "bytes": 289
    },
    {
      "relative_path": "analyses/figure_05_revision/panel_c/config/panel.json",
      "sha256": "535bb26f9c8202229fa8f175d50ab316d3d1a5cdd89cd950f2b2cb11293225f5",
      "bytes": 143
    },
    {
      "relative_path": "data/external/cell_economy_results/swimming/8500/dynamic_flag_0.005.csv",
      "sha256": "7b6eeb0650bda6a58a9590d51757fe52ab107993439d6c106df459126333b1fa",
      "bytes": 11914,
      "rows": 18
    },
    {
      "relative_path": "data/external/cell_economy_results/swimming/8500/dynamic_flag_0.010.csv",
      "sha256": "f93ea16ea209599e4ec3b195d4ffeaf1d0614d35842d0946d869da34382ff15c",
      "bytes": 11918,
      "rows": 18
    },
    {
      "relative_path": "data/external/cell_economy_results/swimming/8500/dynamic_flag_0.020.csv",
      "sha256": "c7223dd00dbea9aabeedd6a663759742eab6ff83c768472a4f091f5a9ebf48e2",
      "bytes": 12095,
      "rows": 18
    },
    {
      "relative_path": "data/external/cell_economy_results/swimming/8500/dynamic_flag_0.030.csv",
      "sha256": "9e1cabd7105a77fe7b0b2c1f70a879db251ac9333f1dfd8bd07662fbf306ee11",
      "bytes": 11947,
      "rows": 18
    },
    {
      "relative_path": "data/external/cell_economy_results/swimming/8500/dynamic_flag_0.040.csv",
      "sha256": "ca18a673ad0b18be9733067856aa99a9d6cf5c007628f4da0b55721a6d1da817",
      "bytes": 12053,
      "rows": 18
    },
    {
      "relative_path": "data/external/cell_economy_results/swimming/8500/dynamic_flag_0.050.csv",
      "sha256": "36e888f3a3adb0b4bdf0148ac9ab737a00a63c819e6a17f628cf41d383abfb1d",
      "bytes": 11992,
      "rows": 18
    }
  ],
  "outputs": [
    {
      "relative_path": "build/panels/Figure_5/C/Figure_5_C.pdf",
      "sha256": "844a5fe37c24649e14c6c9a24d4c458964073f2c993b058c51d3d3316cc680d2",
      "bytes": 31055
    },
    {
      "relative_path": "build/panels/Figure_5/C/Figure_5_C.png",
      "sha256": "5b16ce468d238fd53f48631fbc8c234147c59ee4b7d403c2627f084d353f4972",
      "bytes": 43658
    },
    {
      "relative_path": "build/panels/Figure_5/C/Figure_5_C.svg",
      "sha256": "91051f8b72ddb78ad9f762025de04441768b078cdea961c7ea32514a0d2bfb13",
      "bytes": 50981
    },
    {
      "relative_path": "build/source_data/Figure_5/C/relative_biomass.csv",
      "sha256": "70a1643f2c7c10301dca7a8cc61a9e78952755bea72eedcb168474405cbd6574",
      "bytes": 273,
      "rows": 6
    }
  ],
  "software": {
    "python": "3.12.11",
    "pandas": "2.3.3",
    "numpy": "2.5.2",
    "matplotlib": "3.11.1"
  },
  "parameters": {
    "dynamic_gradient_age_h": 3,
    "dynamic_duration_h": 8,
    "active_model_cells_per_seed": 26,
    "active_model_seed_range": [
      1000,
      1099
    ],
    "active_model_seed_count_per_group": 100,
    "active_model_phenotypes": [
      "PproA",
      "WT",
      "PproB"
    ],
    "active_model_observable": "mean net displacement per seed (um)",
    "active_model_dt_s": 0.0025,
    "active_model_config_dt_s": 0.05,
    "active_model_dt_tolerance": 0.05,
    "active_model_box_scale": 12,
    "active_model_noise_scales": {
      "run_translational_scale": 0.12,
      "reorientation_diffusion_scale": 0.4,
      "stall_slide_fraction": 0.28,
      "stall_rotational_diffusion_scale": 1.8,
      "stall_translational_scale": 0.2
    }
  },
  "random_seeds": {
    "population": "1000-1099",
    "starting_positions": "population seed + 1",
    "agarose_obstacles": "population seed + 300"
  },
  "limitations": [
    "Dynamic trajectories begin from supplied solver result tables because the exact IPOPT runtime is unavailable locally."
  ]
}
