{
  "schema_version": "1.0.0",
  "panel_id": "S3_G",
  "status": "partial_reproduction",
  "generated_at_utc": "2026-08-15T10:03:14.087518Z",
  "command": [
    ".venv/bin/python3.12",
    "analyses/supplementary_03/build_s3.py",
    "--panel",
    "G"
  ],
  "inputs": [
    {
      "relative_path": "analyses/supplementary_03/build_s3.py",
      "sha256": "abdc453b3cd34e05ae6539565b271c034d5553d956576535498ba96247398a78",
      "bytes": 27848
    },
    {
      "relative_path": "analyses/supplementary_03/panel_g/config/panel.json",
      "sha256": "9b3a95572139bdb1dec5c9c8b83b0d3d3ab22dcccce4de0cd26dd40932a281f3",
      "bytes": 77
    },
    {
      "relative_path": "analyses/supplementary_03/panel_g/scripts/reproduce.py",
      "sha256": "40fa871038ab1607fcef71a38331fd2c827ae764342beb3e0f73bbe9814ccffb",
      "bytes": 267
    },
    {
      "relative_path": "data/processed/supplementary_03/motility_competition_paired_measurements.csv",
      "sha256": "e593124975f362714d5b7dc99bc21ea2b9f47b92c23e9ca337ac3a3f7478d59e",
      "bytes": 87105,
      "rows": 208
    }
  ],
  "outputs": [
    {
      "relative_path": "data/source_data/supplementary_03/S3_G_paired_points.csv",
      "sha256": "83861660e45f6a9ed9bbb4993d41c3cd04709ec975927fb2055929d004152dfa",
      "bytes": 3842,
      "rows": 34
    },
    {
      "relative_path": "data/source_data/supplementary_03/S3_G_paired_effect.csv",
      "sha256": "568996241feab9718312079fecd2e864fcdc0442d7bdd935e753089c8a8127c4",
      "bytes": 249,
      "rows": 2
    },
    {
      "relative_path": "build/statistics/Supplementary_Figure_3/G/S3_G_paired_effect_statistics.csv",
      "sha256": "568996241feab9718312079fecd2e864fcdc0442d7bdd935e753089c8a8127c4",
      "bytes": 249,
      "rows": 2
    },
    {
      "relative_path": "build/panels/Supplementary_Figure_3/G/S3_G.png",
      "sha256": "b894a1101b2f78dc2b71b2da01874287452721f0284e550b568cdcb5a49825bf",
      "bytes": 70514
    },
    {
      "relative_path": "build/panels/Supplementary_Figure_3/G/S3_G.svg",
      "sha256": "39e0d399ea0a7f1c88e59c1b2c27399c8cd4dbac4d6444d875a33c6698d417bc",
      "bytes": 47922
    },
    {
      "relative_path": "build/panels/Supplementary_Figure_3/G/S3_G.pdf",
      "sha256": "0ba9f11edb98da604e1e411270de00f6aa022e2e5e46a2450219edea4d994a34",
      "bytes": 30418
    }
  ],
  "software": {
    "python": "3.12.11",
    "pandas": "2.3.3",
    "matplotlib": "3.11.1",
    "numpy": "2.5.2"
  },
  "parameters": {
    "layout": "one metric and one strain pair per panel, the two media side by side",
    "center": "one paired block-level value per strain",
    "line": "paired metadata_key within medium",
    "unit_of_analysis": "paired experimental unit (one metadata_key, one medium)",
    "violin": "kernel density of the plotted unit values, on the plotted scale",
    "plotted_quantity": "log10 of the metric",
    "log_scale": true,
    "summary_mark": "diamond at the group mean of the plotted quantity; the second strain's bar is the paired 95 % interval anchored at the first strain's mean",
    "shared_axis": "the three panels of a metric row share one y range",
    "effect": "ratio",
    "effect_estimator": "mean paired log contrast, back-transformed",
    "interval": "percentile bootstrap over paired experimental units, 95 %",
    "bootstrap_iterations": 10000,
    "n_paired_units": {
      "agarose": 18,
      "liquid": 16
    },
    "statistical_test": "none in plotted panel",
    "multiplicity_correction": "not applicable"
  },
  "random_seeds": {
    "paired_effect_bootstrap": [
      20260812,
      6
    ]
  },
  "limitations": [
    "Starts from the legacy-derived block-level table rather than raw trajectories.",
    "The annotated effect is a paired estimate with a bootstrap interval, not a test.",
    "Final manuscript assembly and visual acceptance remain separate."
  ]
}
