{
  "schema_version": "1.0.0",
  "panel_id": "F1_C",
  "status": "partial_reproduction",
  "generated_at_utc": "2026-08-15T11:45:10.050363Z",
  "command": [
    ".venv/bin/python3.12",
    "-m",
    "analyses.figure_01.panel_c.scripts.plot"
  ],
  "inputs": [
    {
      "relative_path": "analyses/figure_01/panel_c/config/config.json",
      "sha256": "e562003c44b344b793eb45fab2d17e302c693cf07f06f4efb732c4d109e27a2e",
      "bytes": 2195
    },
    {
      "relative_path": "analyses/figure_01/plotting.py",
      "sha256": "fee4d8f83fc291e6ccd03293afcb88e6c154ee44aaf385cab4cb9bb1d286d54c",
      "bytes": 29304
    },
    {
      "relative_path": "analyses/figure_01/panel_c/scripts/plot.py",
      "sha256": "a73aee31ff37f5af272109b76a38245ac1063fb07c07b24beeb681305d1971d5",
      "bytes": 150
    },
    {
      "relative_path": "src/flagella_repro/theme.py",
      "sha256": "d3e93c1eed74fd0b647748e61326d019047f015627fb50377c8b3f1f2cb1cb41",
      "bytes": 11960
    },
    {
      "relative_path": "config/palette.yaml",
      "sha256": "1db43aaa3edd5b6f19a03cfcace6efdba38ccb13ac69260539b61e287eb424b7",
      "bytes": 2704
    },
    {
      "relative_path": "data/processed/figure_01/F1_C/cell_points.csv",
      "sha256": "32b76201f4a7336719d9a5f097b5f4d20b587cccc702b881f4de4906f244779e",
      "bytes": 2752299,
      "rows": 23046
    },
    {
      "relative_path": "data/processed/figure_01/F1_C/replicate_means.csv",
      "sha256": "4d05aa357644b865a32f42a0ae72bf3a86aa514649bf001fee59a09f7d6fce23",
      "bytes": 1881,
      "rows": 21
    },
    {
      "relative_path": "data/processed/figure_01/F1_C/legacy_statistics.csv",
      "sha256": "8e47d58d73d26974db72fa70b9ba4d2b461b104d751beb7c23191b68dfcd1e3e",
      "bytes": 3169,
      "rows": 7
    }
  ],
  "outputs": [
    {
      "relative_path": "build/source_data/Figure_1/C/F1_C_distribution.csv",
      "sha256": "1b03605ba1936624d30bccdfcada0fabf36e313618a7171141f7998e49ecd087",
      "bytes": 2764276,
      "rows": 23046
    },
    {
      "relative_path": "build/source_data/Figure_1/C/F1_C_replicate_means.csv",
      "sha256": "e3697124f1d24a2cf91c896be2225cb5dd2447e8893cc58e804024c912de35aa",
      "bytes": 1817,
      "rows": 21
    },
    {
      "relative_path": "build/statistics/Figure_1/C/F1_C_statistics.csv",
      "sha256": "a83320fa0f712eaedf2aa03c3050927205a48e46fc743c9d1680b751c8e1e125",
      "bytes": 3530,
      "rows": 7
    },
    {
      "relative_path": "build/panels/Figure_1/C/F1_C.svg",
      "sha256": "5ba9550785d2b6a14340988e955c2cdfa0926f03301107401b12d43309e12201",
      "bytes": 48988
    },
    {
      "relative_path": "build/panels/Figure_1/C/F1_C.pdf",
      "sha256": "5355f63ddcc95977d0124c2506727eff07894a9811cf8df27bd1df3bbfd93711",
      "bytes": 33058
    },
    {
      "relative_path": "build/panels/Figure_1/C/F1_C.png",
      "sha256": "59d49e9a2ce11b55c6c1c3f49021024f866b4dc51b3e6b0e58145acbac7bba97",
      "bytes": 76229
    }
  ],
  "software": {
    "python": "3.12.11",
    "matplotlib": "3.11.1",
    "numpy": "2.5.2",
    "pandas": "2.3.3",
    "scipy": "1.18.0",
    "seaborn": "0.13.2"
  },
  "parameters": {
    "recipe": "discrete_count",
    "current_panel_labels": true,
    "reproduction_scope": "migrated processed tables to standalone panel"
  },
  "random_seeds": {
    "bootstrap": null
  },
  "limitations": [
    "Starts from migrated processed cell tables, not archived raw microscopy segmentation outputs.",
    "The archived condition strings state the anhydrotetracycline dose in the wrong unit; the builder restates it as ng/mL, which Marc Erhardt confirmed on 15 August 2026. The dose numbers are unchanged.",
    "Final multi-panel assembly and pixel-level reference comparison are not yet implemented."
  ]
}
