{
  "schema_version": "1.0.0",
  "panel_id": "S1_A",
  "status": "partial_reproduction",
  "generated_at_utc": "2026-08-14T19:53:16.306684Z",
  "command": [
    ".venv/bin/python3.12",
    "-m",
    "analyses.supplementary_01.panel_a.scripts.plot"
  ],
  "inputs": [
    {
      "relative_path": "analyses/supplementary_01/panel_a/config/config.json",
      "sha256": "ef06f194a91d7a5b3895bfd9dc3adff92b15ccb74793a49f272eb50494bd6f9c",
      "bytes": 1312
    },
    {
      "relative_path": "analyses/figure_02/panel_c/scripts/plot.py",
      "sha256": "e2f2f26888340373b2f58d3bdec9fe525944c6c8e0ebe455dacbfa69f227c075",
      "bytes": 21505
    },
    {
      "relative_path": "analyses/supplementary_01/panel_a/scripts/plot.py",
      "sha256": "852b23cd994d050d09b2e013db8373974872154d9c4df508e3bdef5422684ed3",
      "bytes": 188
    },
    {
      "relative_path": "src/flagella_repro/theme.py",
      "sha256": "d3e93c1eed74fd0b647748e61326d019047f015627fb50377c8b3f1f2cb1cb41",
      "bytes": 11960
    },
    {
      "relative_path": "config/palette.yaml",
      "sha256": "1db43aaa3edd5b6f19a03cfcace6efdba38ccb13ac69260539b61e287eb424b7",
      "bytes": 2704
    },
    {
      "relative_path": "data/processed/supplementary_01/S1_A/cell_points.parquet",
      "sha256": "cb8141d87d33809d1a6a98e4bdbd676d3d1db08f0b7dbc8c4c74129c2255cc50",
      "bytes": 1526302,
      "rows": 126934
    },
    {
      "relative_path": "data/processed/supplementary_01/S1_A/replicate_means.csv",
      "sha256": "b9d805b6dc142150a1fa59db9ab2c3129dd2e44ed1c3cd4ec10052183fc80d94",
      "bytes": 875,
      "rows": 16
    },
    {
      "relative_path": "data/source_data/supplementary_01/S1_A.csv.gz",
      "sha256": "6ad4fa44235cd44a86090e2368e77b8b3f69029791281e99d2a0fbddd50d39ef",
      "bytes": 1301605,
      "rows": 126934
    },
    {
      "relative_path": "analyses/supplementary_01/panel_a/metadata/migration_inventory.json",
      "sha256": "30e32475f3ca632b24643696836e0ce6ce94771a706091ab83ea010b51fc5877",
      "bytes": 2070
    }
  ],
  "outputs": [
    {
      "relative_path": "data/source_data/supplementary_01/S1_A.csv.gz",
      "sha256": "6ad4fa44235cd44a86090e2368e77b8b3f69029791281e99d2a0fbddd50d39ef",
      "bytes": 1301605,
      "rows": 126934
    },
    {
      "relative_path": "build/source_data/Supplementary_Figure_1/A/S1_A_source_data.csv.gz",
      "sha256": "d2b39f0cd569f7129c5234cd1d06188d14a339ab8ffba2bc17e7c58b2e50917b",
      "bytes": 1301626,
      "rows": 126934
    },
    {
      "relative_path": "build/panels/Supplementary_Figure_1/A/summary.csv",
      "sha256": "f963b0aeed7d9a4b6392e8227e5823eb9eff2816c1740e4dbcd016ec9a504940",
      "bytes": 462,
      "rows": 8
    },
    {
      "relative_path": "build/panels/Supplementary_Figure_1/A/S1_A.svg",
      "sha256": "1ce08b04d8aeebe2aa125263a130bc1f3971ea0ab9fcd0506b57402a132af857",
      "bytes": 61317
    },
    {
      "relative_path": "build/panels/Supplementary_Figure_1/A/S1_A.pdf",
      "sha256": "c65e2eb10be5724316949bee3d2eee59a0b87de78608203000a4af463cf0501b",
      "bytes": 38083
    },
    {
      "relative_path": "build/panels/Supplementary_Figure_1/A/S1_A.png",
      "sha256": "cb3c745cc6caf3658f7efb32136fc1d1b1d54cef39cec1a907a6b1fb1dfe8513",
      "bytes": 124146
    }
  ],
  "software": {
    "python": "3.12.11",
    "matplotlib": "3.11.1",
    "pandas": "2.3.3",
    "pyarrow": "22.0.0",
    "seaborn": "0.13.2"
  },
  "parameters": {
    "value_column": "growth_norm",
    "filters": {
      "_subset": [
        "mother_only",
        "non_mother"
      ],
      "_window_start_min": [
        200
      ],
      "_window_end_min": [
        800
      ]
    },
    "biological_unit": "independent experiment/replicate",
    "cell_points_role": "descriptive distribution",
    "normalization_reference": null,
    "normalization": "values are plotted as stored in the migrated normalized table",
    "display_y_limits": [
      0.69,
      1.17
    ],
    "display_clipping_only": true,
    "inferential_test": "none; the panel is descriptive",
    "migration_command": [
      ".venv/bin/python3.12",
      "-m",
      "not_available_for_revision_alias",
      "--write"
    ]
  },
  "random_seeds": {
    "jitter": null,
    "bootstrap": null
  },
  "limitations": [
    "The workflow starts from an archived processed per-cell table; raw microscopy, mother-machine tracking files, and image-to-cell extraction are absent.",
    "The compact table is a checksum-backed extraction because the legacy CSV exceeds the collection's no-LFS 100 MB policy.",
    "Final multi-panel assembly and pixel-level comparison to the current manuscript export are not yet implemented."
  ]
}
