{
  "schema_version": "1.0.0",
  "panel_id": "F1_D",
  "status": "partial_reproduction",
  "generated_at_utc": "2026-08-15T11:45:11.510778Z",
  "command": [
    ".venv/bin/python3.12",
    "-m",
    "analyses.figure_01.panel_d.scripts.plot"
  ],
  "inputs": [
    {
      "relative_path": "analyses/figure_01/panel_d/config/config.json",
      "sha256": "7c241878d963c93647e9feaa4bed496e23420f89536d7fe321698df5355f8b8d",
      "bytes": 2372
    },
    {
      "relative_path": "analyses/figure_01/plotting.py",
      "sha256": "fee4d8f83fc291e6ccd03293afcb88e6c154ee44aaf385cab4cb9bb1d286d54c",
      "bytes": 29304
    },
    {
      "relative_path": "analyses/figure_01/panel_d/scripts/plot.py",
      "sha256": "a73aee31ff37f5af272109b76a38245ac1063fb07c07b24beeb681305d1971d5",
      "bytes": 150
    },
    {
      "relative_path": "src/flagella_repro/theme.py",
      "sha256": "d3e93c1eed74fd0b647748e61326d019047f015627fb50377c8b3f1f2cb1cb41",
      "bytes": 11960
    },
    {
      "relative_path": "config/palette.yaml",
      "sha256": "1db43aaa3edd5b6f19a03cfcace6efdba38ccb13ac69260539b61e287eb424b7",
      "bytes": 2704
    },
    {
      "relative_path": "data/processed/figure_01/F1_D/cell_points.csv",
      "sha256": "55534cd2b470d969639e6a3a6d19a24f6549f6f1a497f9c4f03f96c5672e4a0f",
      "bytes": 2752302,
      "rows": 23046
    },
    {
      "relative_path": "data/processed/figure_01/F1_D/replicate_means.csv",
      "sha256": "b3553a3537f27f92515b4448fa1c9ae9dca572f1dce968bb80ee9f728550e955",
      "bytes": 1887,
      "rows": 21
    },
    {
      "relative_path": "data/processed/figure_01/F1_D/legacy_statistics.csv",
      "sha256": "a09acfc6094379cddda7ac4c622d15ae6d70caf11b0b03f181130eccec356277",
      "bytes": 3180,
      "rows": 7
    }
  ],
  "outputs": [
    {
      "relative_path": "build/source_data/Figure_1/D/F1_D_distribution.csv",
      "sha256": "41a5204be5f8a5ac5262aa5c70808154e24dc45031613f8d3583a1299cb15be9",
      "bytes": 2764279,
      "rows": 23046
    },
    {
      "relative_path": "build/source_data/Figure_1/D/F1_D_replicate_means.csv",
      "sha256": "1f46ede338a2db0264347c0f3c84354fcbc84c881056753724bfdcf5fbd70600",
      "bytes": 1825,
      "rows": 21
    },
    {
      "relative_path": "build/statistics/Figure_1/D/F1_D_statistics.csv",
      "sha256": "ab0450d4cac6edbaa7ede81339f587b715e4574b0e08f29dfeeb2b60007255c4",
      "bytes": 3523,
      "rows": 7
    },
    {
      "relative_path": "build/panels/Figure_1/D/F1_D.svg",
      "sha256": "337e608c2a6be3b6a2b872b6fda22b04f96675bc66a34d1efbc6a07487a34b47",
      "bytes": 48386
    },
    {
      "relative_path": "build/panels/Figure_1/D/F1_D.pdf",
      "sha256": "945eedd5a6617fff2e28c5b2a5933842875bba3b1f11b4f08ee924ab867b8b8e",
      "bytes": 32403
    },
    {
      "relative_path": "build/panels/Figure_1/D/F1_D.png",
      "sha256": "cb918b36da318ad497a9b6cac611688fe41e373bdbbc1df08a1e6c4cddc501b7",
      "bytes": 76926
    }
  ],
  "software": {
    "python": "3.12.11",
    "matplotlib": "3.11.1",
    "numpy": "2.5.2",
    "pandas": "2.3.3",
    "scipy": "1.18.0",
    "seaborn": "0.13.2"
  },
  "parameters": {
    "recipe": "discrete_count",
    "current_panel_labels": true,
    "reproduction_scope": "migrated processed tables to standalone panel"
  },
  "random_seeds": {
    "bootstrap": null
  },
  "limitations": [
    "Starts from migrated processed cell tables, not archived raw microscopy segmentation outputs.",
    "Legacy bundle calls this flagella count while the current panel calls it filament count; the current terminology is encoded but requires author confirmation.",
    "The archived condition strings state the anhydrotetracycline dose in the wrong unit; the builder restates it as ng/mL, which Marc Erhardt confirmed on 15 August 2026. The dose numbers are unchanged.",
    "Final multi-panel assembly and pixel-level reference comparison are not yet implemented."
  ]
}
